{
  "schema_version": "1",
  "report_date": "20260901",
  "source_run_id": "33415374005",
  "index": {
    "total_count": 591,
    "candidate_count": 7,
    "full_update": false,
    "mode": "fast",
    "fast_path": true,
    "fallback_reason": "none",
    "age_coverage": 1.0,
    "reason_counts": {
      "recent_update": 7
    }
  },
  "fetch": {
    "totals": {
      "network_requests": 8,
      "status_200": 8,
      "status_304": 0,
      "failures": 0,
      "body_bytes": 3063054,
      "cache_hits": 0,
      "duration_seconds": 9.724
    },
    "phases": {
      "index": {
        "network_requests": 1,
        "status_200": 1,
        "status_304": 0,
        "failures": 0,
        "body_bytes": 853729,
        "cache_hits": 0,
        "started_at": "2026-08-31T16:40:19.775493Z",
        "duration_seconds": 2.654
      },
      "details": {
        "network_requests": 7,
        "status_200": 7,
        "status_304": 0,
        "failures": 0,
        "body_bytes": 2209325,
        "cache_hits": 0,
        "started_at": "2026-08-31T16:40:22.921960Z",
        "duration_seconds": 7.07
      }
    }
  },
  "detail_fetch": {
    "attempted_url_count": 7,
    "successful_url_count": 7,
    "failed_url_count": 0,
    "http_status_counts": {
      "200": 7
    },
    "conditional_cache_hit_count": 0,
    "cache_utilization": 0.0,
    "state_entry_count": 591
  },
  "details": {
    "json_records": 16,
    "jsonl_records": 16
  },
  "msdata_diff": {
    "old_count": 1702,
    "new_count": 1704,
    "added": 2,
    "removed": 0,
    "changed": 2
  },
  "warnings": []
}
