{
  "schema_version": "1",
  "report_date": "20260601",
  "source_run_id": "26750333965",
  "index": {
    "total_count": 574,
    "candidate_count": 19,
    "full_update": false,
    "fast_path": true,
    "fallback_reason": "none",
    "age_coverage": 1.0,
    "reason_counts": {
      "recent_update": 19
    }
  },
  "detail_fetch": {
    "attempted_url_count": 19,
    "successful_url_count": 19,
    "failed_url_count": 0,
    "http_status_counts": {
      "200": 19
    },
    "conditional_cache_hit_count": 0,
    "cache_utilization": 0.0,
    "state_entry_count": 574
  },
  "details": {
    "json_records": 48,
    "jsonl_records": 48
  },
  "msdata_diff": {
    "old_count": 1644,
    "new_count": 1645,
    "added": 1,
    "removed": 0,
    "changed": 14
  },
  "warnings": []
}
